{
  "schema_version": "cpu-prefetch-phase18-readiness-report/1",
  "report_id": null,
  "stage17_completion_id": null,
  "stage17_completion_sha256": null,
  "sealed_pilot_manifest_sha256": null,
  "treatment_blind_freeze_sha256": null,
  "role_separation_declaration_sha256": null,
  "state": "UNISSUED",
  "blockers": ["REAL_STAGE17_PILOT_EVIDENCE_REQUIRED"],
  "phase18_authority": false
}
